{
  "$schema": "https://json-schema.org/draft/2020-12/schema",
  "$id": "https://kite-hybrid.local/contracts/v1/envelope.schema.json",
  "title": "Event envelope v1",
  "type": "object",
  "required": [
    "schema_version",
    "event_id",
    "event_type",
    "event_timestamp",
    "payload"
  ],
  "properties": {
    "schema_version": {
      "const": 1,
      "type": "integer"
    },
    "event_id": {
      "$ref": "#/$defs/uuid"
    },
    "event_type": {
      "type": "string",
      "minLength": 1
    },
    "event_timestamp": {
      "type": "string",
      "format": "date-time",
      "pattern": "^\\d{4}-\\d{2}-\\d{2}T\\d{2}:\\d{2}:\\d{2}(?:\\.\\d{1,6})?Z$"
    },
    "correlation_id": {
      "$ref": "#/$defs/uuid"
    },
    "payload": {
      "type": "object"
    }
  },
  "$defs": {
    "uuid": {
      "type": "string",
      "format": "uuid",
      "pattern": "^[0-9a-f]{8}-[0-9a-f]{4}-[0-9a-f]{4}-[0-9a-f]{4}-[0-9a-f]{12}$"
    }
  }
}
