{
  "schema_version": 1,
  "event_id": "11111111-1111-4111-8111-111111111111",
  "event_type": "SignalEvent",
  "event_timestamp": "2026-01-01T09:00:00Z",
  "correlation_id": "22222222-2222-4222-8222-222222222222",
  "payload": {
    "signal_id": "33333333-3333-4333-8333-333333333333",
    "strategy_id": "research-example",
    "instrument_id": "44444444-4444-4444-8444-444444444444",
    "side": "BUY",
    "quantity": 10,
    "reference_price": "123.4500"
  }
}
